{
  "sourceId": "unified-shoes-20260803",
  "sourceType": "repository_snapshot",
  "uri": "contracts/collector/unified/examples/unified_구두_top20_20260803_002024.json",
  "sha256": "405aca85db0a574aefb9da61fc59d5694bd93b5adace6e9e102b3d85cd8608ec",
  "collectedAt": "2026-08-03T00:20:24+09:00",
  "license": "merchant facts are evidence references and are not relicensed",
  "containsMerchantFacts": true
}
